{"cases":{"release_322_r452":"compatible","release_322_r443":"incompatible","unlisted_package_version":"unverified"},"positive_package":{"name":"DESeq2","version":"1.50.2"},"rationale":"The official release table maps Bioconductor 3.22 to R 4.5, so R 4.5.2 matches and R 4.4.3 does not. The unlisted package/version cannot be verified from the frozen 3.22 snapshot and should not be called incompatible without a constraint.","sources":["https://bioconductor.org/about/release-announcements/","https://bioconductor.org/packages/3.22/bioc/html/DESeq2.html"]}
